{
  "schemaVersion": 1,
  "scoreType": "database-storage",
  "userId": "alex-i9-test",
  "corpusId": "realistic",
  "storageInput": {
    "ingestionMode": "known-schema-document-ingestion",
    "statusesScored": [
      "ACTIVE"
    ],
    "suggestionsWereAutoApplied": true
  },
  "fixtureReadiness": {
    "scorable": true,
    "blockingIssues": []
  },
  "summary": {
    "knownPresentTotal": 22,
    "knownPresentCorrect": 15,
    "knownPresentWrongSlug": 1,
    "knownPresentWrongValue": 6,
    "knownPresentConflict": 0,
    "knownPresentMissing": 0,
    "valueRecoveryRate": 0.727,
    "acceptedSlugAccuracy": 0.682,
    "acceptedSlugRecoveryRate": 0.682,
    "intentionallyMissingTotal": 1,
    "missingAbsentCorrect": 0,
    "missingHallucinated": 1,
    "missingAbstentionRate": 0,
    "ignoredStoredPreferenceCount": 0,
    "unscoredStoredPreferenceCount": 5
  },
  "knownPresent": [
    {
      "factKey": "address.current.city",
      "expectedValue": "Portland",
      "canonicalSlugs": [
        "eval.address.current.city"
      ],
      "acceptedAliasSlugs": [],
      "expectedValueFoundAnywhere": false,
      "expectedValueFoundUnderAcceptedSlug": false,
      "acceptedSlugPopulated": true,
      "acceptedSlugHasWrongValue": true,
      "canonicalSlugCorrect": false,
      "acceptedAliasCorrect": false,
      "matchingRows": [],
      "acceptedSlugRows": [
        {
          "slug": "eval.address.current.city",
          "value": "Oakmont",
          "status": "ACTIVE",
          "sourceType": "INFERRED",
          "confidence": 0.9
        }
      ],
      "classification": "known_present_wrong_value"
    },
    {
      "factKey": "address.current.postalCode",
      "expectedValue": "97214",
      "canonicalSlugs": [
        "eval.address.current.postal_code"
      ],
      "acceptedAliasSlugs": [],
      "expectedValueFoundAnywhere": true,
      "expectedValueFoundUnderAcceptedSlug": true,
      "acceptedSlugPopulated": true,
      "acceptedSlugHasWrongValue": false,
      "canonicalSlugCorrect": true,
      "acceptedAliasCorrect": false,
      "matchingRows": [
        {
          "slug": "eval.address.current.postal_code",
          "value": "97214",
          "status": "ACTIVE",
          "sourceType": "INFERRED",
          "confidence": 0.98
        }
      ],
      "acceptedSlugRows": [
        {
          "slug": "eval.address.current.postal_code",
          "value": "97214",
          "status": "ACTIVE",
          "sourceType": "INFERRED",
          "confidence": 0.98
        }
      ],
      "classification": "known_present_correct"
    },
    {
      "factKey": "address.current.state",
      "expectedValue": "OR",
      "canonicalSlugs": [
        "eval.address.current.state"
      ],
      "acceptedAliasSlugs": [],
      "expectedValueFoundAnywhere": true,
      "expectedValueFoundUnderAcceptedSlug": true,
      "acceptedSlugPopulated": true,
      "acceptedSlugHasWrongValue": false,
      "canonicalSlugCorrect": true,
      "acceptedAliasCorrect": false,
      "matchingRows": [
        {
          "slug": "eval.address.current.state",
          "value": "OR",
          "status": "ACTIVE",
          "sourceType": "INFERRED",
          "confidence": 0.98
        }
      ],
      "acceptedSlugRows": [
        {
          "slug": "eval.address.current.state",
          "value": "OR",
          "status": "ACTIVE",
          "sourceType": "INFERRED",
          "confidence": 0.98
        }
      ],
      "classification": "known_present_correct"
    },
    {
      "factKey": "address.current.street",
      "expectedValue": "7428 Evergreen Terrace",
      "canonicalSlugs": [
        "eval.address.current.street"
      ],
      "acceptedAliasSlugs": [],
      "expectedValueFoundAnywhere": false,
      "expectedValueFoundUnderAcceptedSlug": false,
      "acceptedSlugPopulated": true,
      "acceptedSlugHasWrongValue": true,
      "canonicalSlugCorrect": false,
      "acceptedAliasCorrect": false,
      "matchingRows": [],
      "acceptedSlugRows": [
        {
          "slug": "eval.address.current.street",
          "value": "123 Main Street",
          "status": "ACTIVE",
          "sourceType": "INFERRED",
          "confidence": 0.9
        }
      ],
      "classification": "known_present_wrong_value"
    },
    {
      "factKey": "address.current.unit",
      "expectedValue": "Apt 5C",
      "canonicalSlugs": [
        "eval.address.current.unit"
      ],
      "acceptedAliasSlugs": [],
      "expectedValueFoundAnywhere": true,
      "expectedValueFoundUnderAcceptedSlug": true,
      "acceptedSlugPopulated": true,
      "acceptedSlugHasWrongValue": false,
      "canonicalSlugCorrect": true,
      "acceptedAliasCorrect": false,
      "matchingRows": [
        {
          "slug": "eval.address.current.unit",
          "value": "Apt 5C",
          "status": "ACTIVE",
          "sourceType": "INFERRED",
          "confidence": 1
        }
      ],
      "acceptedSlugRows": [
        {
          "slug": "eval.address.current.unit",
          "value": "Apt 5C",
          "status": "ACTIVE",
          "sourceType": "INFERRED",
          "confidence": 1
        }
      ],
      "classification": "known_present_correct"
    },
    {
      "factKey": "contact.email",
      "expectedValue": "alex.rivera@example.test",
      "canonicalSlugs": [
        "profile.email"
      ],
      "acceptedAliasSlugs": [
        "contact.email",
        "eval.contact.email"
      ],
      "expectedValueFoundAnywhere": false,
      "expectedValueFoundUnderAcceptedSlug": false,
      "acceptedSlugPopulated": true,
      "acceptedSlugHasWrongValue": true,
      "canonicalSlugCorrect": false,
      "acceptedAliasCorrect": false,
      "matchingRows": [],
      "acceptedSlugRows": [
        {
          "slug": "profile.email",
          "value": "announcements@example.test",
          "status": "ACTIVE",
          "sourceType": "INFERRED",
          "confidence": 0.8
        }
      ],
      "classification": "known_present_wrong_value"
    },
    {
      "factKey": "employment.company",
      "expectedValue": "Cascadia Hiring Cooperative",
      "canonicalSlugs": [
        "profile.company"
      ],
      "acceptedAliasSlugs": [
        "employment.company",
        "eval.employment.company"
      ],
      "expectedValueFoundAnywhere": true,
      "expectedValueFoundUnderAcceptedSlug": true,
      "acceptedSlugPopulated": true,
      "acceptedSlugHasWrongValue": false,
      "canonicalSlugCorrect": true,
      "acceptedAliasCorrect": false,
      "matchingRows": [
        {
          "slug": "profile.company",
          "value": "Cascadia Hiring Cooperative",
          "status": "ACTIVE",
          "sourceType": "INFERRED",
          "confidence": 1
        }
      ],
      "acceptedSlugRows": [
        {
          "slug": "profile.company",
          "value": "Cascadia Hiring Cooperative",
          "status": "ACTIVE",
          "sourceType": "INFERRED",
          "confidence": 1
        }
      ],
      "classification": "known_present_correct"
    },
    {
      "factKey": "employment.startDate",
      "expectedValue": "2026-06-17",
      "canonicalSlugs": [
        "eval.employment.start_date"
      ],
      "acceptedAliasSlugs": [],
      "expectedValueFoundAnywhere": true,
      "expectedValueFoundUnderAcceptedSlug": true,
      "acceptedSlugPopulated": true,
      "acceptedSlugHasWrongValue": false,
      "canonicalSlugCorrect": true,
      "acceptedAliasCorrect": false,
      "matchingRows": [
        {
          "slug": "eval.employment.start_date",
          "value": "2026-06-17",
          "status": "ACTIVE",
          "sourceType": "INFERRED",
          "confidence": 1
        }
      ],
      "acceptedSlugRows": [
        {
          "slug": "eval.employment.start_date",
          "value": "2026-06-17",
          "status": "ACTIVE",
          "sourceType": "INFERRED",
          "confidence": 1
        }
      ],
      "classification": "known_present_correct"
    },
    {
      "factKey": "employment.title",
      "expectedValue": "Operations Specialist",
      "canonicalSlugs": [
        "profile.title"
      ],
      "acceptedAliasSlugs": [
        "employment.title",
        "eval.employment.title"
      ],
      "expectedValueFoundAnywhere": true,
      "expectedValueFoundUnderAcceptedSlug": true,
      "acceptedSlugPopulated": true,
      "acceptedSlugHasWrongValue": false,
      "canonicalSlugCorrect": true,
      "acceptedAliasCorrect": false,
      "matchingRows": [
        {
          "slug": "profile.title",
          "value": "Operations Specialist",
          "status": "ACTIVE",
          "sourceType": "INFERRED",
          "confidence": 1
        }
      ],
      "acceptedSlugRows": [
        {
          "slug": "profile.title",
          "value": "Operations Specialist",
          "status": "ACTIVE",
          "sourceType": "INFERRED",
          "confidence": 1
        }
      ],
      "classification": "known_present_correct"
    },
    {
      "factKey": "employment.workEmail",
      "expectedValue": "alex.rivera@cascadiahiring.example.test",
      "canonicalSlugs": [
        "eval.employment.work_email"
      ],
      "acceptedAliasSlugs": [],
      "expectedValueFoundAnywhere": true,
      "expectedValueFoundUnderAcceptedSlug": true,
      "acceptedSlugPopulated": true,
      "acceptedSlugHasWrongValue": false,
      "canonicalSlugCorrect": true,
      "acceptedAliasCorrect": false,
      "matchingRows": [
        {
          "slug": "eval.employment.work_email",
          "value": "alex.rivera@cascadiahiring.example.test",
          "status": "ACTIVE",
          "sourceType": "INFERRED",
          "confidence": 1
        }
      ],
      "acceptedSlugRows": [
        {
          "slug": "eval.employment.work_email",
          "value": "alex.rivera@cascadiahiring.example.test",
          "status": "ACTIVE",
          "sourceType": "INFERRED",
          "confidence": 1
        }
      ],